{
  "$schema": "https://www.asakiri.com/registry/course.schema.json",
  "id": "course_japanese_starter",
  "title": "Japanese Starter",
  "description": "A beginner's path into Japanese for English speakers, from kana to first sentences.",
  "author": { "name": "Asakiri", "url": "https://github.com/AsakiriLingo" },
  "repo": "https://github.com/AsakiriLingo/course-japanese-starter",
  "teaches": ["ja"],
  "from": ["en"],
  "tags": ["beginner", "example"],
  "license": "CC-BY-4.0",
  "latest": "1.2.0",
  "releases": [
    {
      "version": "1.2.0",
      "tag": "v1.2.0",
      "releasedAt": "2026-08-09",
      "formatVersion": "0.1",
      "breaking": false,
      "source": "https://github.com/AsakiriLingo/course-japanese-starter/archive/refs/tags/v1.2.0.tar.gz",
      "changelog": "https://github.com/AsakiriLingo/course-japanese-starter/releases/tag/v1.2.0",
      "notes": "Added chapter 4 (particles); 12 new native-audio clips for chapter 2."
    },
    {
      "version": "1.0.0",
      "tag": "v1.0.0",
      "releasedAt": "2026-06-01",
      "formatVersion": "0.1",
      "breaking": false,
      "source": "https://github.com/AsakiriLingo/course-japanese-starter/archive/refs/tags/v1.0.0.tar.gz",
      "changelog": "https://github.com/AsakiriLingo/course-japanese-starter/releases/tag/v1.0.0",
      "notes": "First public release: kana, greetings, and numbers."
    }
  ]
}
